tweet_id,in_reply_to_status_id,in_reply_to_user_id,timestamp,source,text,retweeted_status_id,retweeted_status_user_id,retweeted_status_timestamp,expanded_urls,rating_numerator,rating_denominator,name,doggo,floofer,pupper,puppo,dog_stage,id,retweet_count,favorite_count,id_str,full_text,jpg_url,img_num,p1,p1_conf,p1_dog,p2,p2_conf,p2_dog,p3,p3_conf,p3_dog
725729321944506368,,,2016-04-28 16:52:08+00:00,"<a href=""http://twitter.com/download/iphone"" rel=""nofollow"">Twitter for iPhone</a>",This is Lola. She's a Butternut Splishnsplash. They are known to be ferocious af. 12/10 would absolutely still pet https://t.co/adQt5a6TZU,,,,https://twitter.com/dog_rates/status/725729321944506368/photo/1,12,10,Lola,,,,,,7.257293219445064e+17,2009.0,5646.0,725729321944506368,This is Lola. She's a Butternut Splishnsplash. They are known to be ferocious af. 12/10 would absolutely still pet https://t.co/adQt5a6TZU,https://pbs.twimg.com/media/ChJO9YaWYAEL0zC.jpg,1,boxer,0.599076,True,bull_mastiff,0.177318,True,French_bulldog,0.141461,True
724983749226668032,,,2016-04-26 15:29:30+00:00,"<a href=""http://twitter.com/download/iphone"" rel=""nofollow"">Twitter for iPhone</a>",This is Fred-Rick. He dabbles in parkour. The elevation gives him power. 12/10 hopefully visiting a mailbox near you https://t.co/qFqLtudIiD,,,,https://twitter.com/dog_rates/status/724983749226668032/photo/1,12,10,Fred,,,,,,7.24983749226668e+17,1462.0,4040.0,724983749226668032,This is Fred-Rick. He dabbles in parkour. The elevation gives him power. 12/10 hopefully visiting a mailbox near you https://t.co/qFqLtudIiD,https://pbs.twimg.com/media/Cg-o3w0WgAANXdv.jpg,1,golden_retriever,0.67575,True,Great_Pyrenees,0.0951679,True,cocker_spaniel,0.0760429,True
724405726123311104,,,2016-04-25 01:12:38+00:00,"<a href=""http://twitter.com/download/iphone"" rel=""nofollow"">Twitter for iPhone</a>",This is Ashleigh. She's having Coachella withdrawals. Didn't even go tho. 10/10 stay strong pupper https://t.co/nRUaKWnJfH,,,,https://twitter.com/dog_rates/status/724405726123311104/photo/1,10,10,Ashleigh,,,pupper,,pupper,7.244057261233111e+17,1847.0,5800.0,724405726123311104,This is Ashleigh. She's having Coachella withdrawals. Didn't even go tho. 10/10 stay strong pupper https://t.co/nRUaKWnJfH,https://pbs.twimg.com/media/Cg2bKLAWwAA0WEm.jpg,1,golden_retriever,0.240695,True,cocker_spaniel,0.202444,True,feather_boa,0.159348,False
724049859469295616,,,2016-04-24 01:38:33+00:00,"<a href=""http://twitter.com/download/iphone"" rel=""nofollow"">Twitter for iPhone</a>",This is Kreggory. He just took a look at his student debt. 10/10 can't even comprehend it https://t.co/XTsZTgilnT,,,,https://twitter.com/dog_rates/status/724049859469295616/photo/1,10,10,Kreggory,,,,,,7.240498594692956e+17,1984.0,4738.0,724049859469295616,This is Kreggory. He just took a look at his student debt. 10/10 can't even comprehend it https://t.co/XTsZTgilnT,https://pbs.twimg.com/media/CgxXf1TWYAEjY61.jpg,1,Border_collie,0.581835,True,collie,0.344588,True,Shetland_sheepdog,0.0435842,True
723912936180330496,,,2016-04-23 16:34:28+00:00,"<a href=""http://twitter.com/download/iphone"" rel=""nofollow"">Twitter for iPhone</a>",This is Sugar. She's a Bolivian Superfloof. Spherical af. 12/10 would never let go of https://t.co/AhMfUu6Onm,,,,https://twitter.com/dog_rates/status/723912936180330496/photo/1,12,10,Sugar,,,,,,7.239129361803305e+17,1374.0,4236.0,723912936180330496,This is Sugar. She's a Bolivian Superfloof. Spherical af. 12/10 would never let go of https://t.co/AhMfUu6Onm,https://pbs.twimg.com/media/Cgva-QqUUAA7Hv9.jpg,1,Samoyed,0.991772,True,Pomeranian,0.00362638,True,chow,0.00223183,True
723673163800948736,,,2016-04-23 00:41:42+00:00,"<a href=""http://twitter.com/download/iphone"" rel=""nofollow"">Twitter for iPhone</a>",This is Ivar. She is a badass Viking warrior. Will sack your village. 10/10 savage af https://t.co/Dz6MiVssVU,,,,https://twitter.com/dog_rates/status/723673163800948736/photo/1,10,10,Ivar,,,,,,7.236731638009487e+17,1011.0,3291.0,723673163800948736,This is Ivar. She is a badass Viking warrior. Will sack your village. 10/10 savage af https://t.co/Dz6MiVssVU,https://pbs.twimg.com/media/CgsA5eFWgAAu0qn.jpg,1,golden_retriever,0.83939,True,Labrador_retriever,0.0657058,True,hand_blower,0.012941,False
723179728551723008,,,2016-04-21 16:00:57+00:00,"<a href=""http://twitter.com/download/iphone"" rel=""nofollow"">Twitter for iPhone</a>",This is Jangle. She's addicted to broccoli. It's the only thing she cares about. Tragic af. 8/10 get help pup https://t.co/8dNWp1cSEa,,,,https://twitter.com/dog_rates/status/723179728551723008/photo/1,8,10,Jangle,,,,,,7.23179728551723e+17,2110.0,5761.0,723179728551723008,This is Jangle. She's addicted to broccoli. It's the only thing she cares about. Tragic af. 8/10 get help pup https://t.co/8dNWp1cSEa,https://pbs.twimg.com/media/CglAHjAUgAAfxcq.jpg,1,tennis_ball,0.176495,False,badger,0.0599052,False,Norwegian_elkhound,0.0568505,True
722974582966214656,,,2016-04-21 02:25:47+00:00,"<a href=""http://twitter.com/download/iphone"" rel=""nofollow"">Twitter for iPhone</a>",Happy 4/20 from the squad! 13/10 for all https://t.co/eV1diwds8a,,,,https://twitter.com/dog_rates/status/722974582966214656/photo/1,4,20,None,,,,,,7.229745829662147e+17,1764.0,4493.0,722974582966214656,Happy 4/20 from the squad! 13/10 for all https://t.co/eV1diwds8a,https://pbs.twimg.com/media/CgiFjIpWgAA4wVp.jpg,1,Great_Dane,0.246762,True,Greater_Swiss_Mountain_dog,0.126131,True,Weimaraner,0.0852969,True
722613351520608256,,,2016-04-20 02:30:23+00:00,"<a href=""http://twitter.com/download/iphone"" rel=""nofollow"">Twitter for iPhone</a>",Meet Schnitzel. He's a Tropicana Floofboop. Getting too big for his favorite basket. 12/10 just so damn fluffy https://t.co/qjd0UJKYUY,,,,https://twitter.com/dog_rates/status/722613351520608256/photo/1,12,10,Schnitzel,,,,,,7.226133515206083e+17,1831.0,5393.0,722613351520608256,Meet Schnitzel. He's a Tropicana Floofboop. Getting too big for his favorite basket. 12/10 just so damn fluffy https://t.co/qjd0UJKYUY,https://pbs.twimg.com/media/Cgc9AjMVIAERdUA.jpg,1,Labrador_retriever,0.5309149999999999,True,golden_retriever,0.28823000000000004,True,chow,0.0448537,True
721503162398597120,,,2016-04-17 00:58:53+00:00,"<a href=""http://twitter.com/download/iphone"" rel=""nofollow"">Twitter for iPhone</a>",This is Panda. He's happy af. 11/10 https://t.co/IOAk9i4UvE,,,,"https://twitter.com/dog_rates/status/721503162398597120/photo/1,https://twitter.com/dog_rates/status/721503162398597120/photo/1,https://twitter.com/dog_rates/status/721503162398597120/photo/1,https://twitter.com/dog_rates/status/721503162398597120/photo/1",11,10,Panda,,,,,,7.215031623985971e+17,2124.0,5086.0,721503162398597120,This is Panda. He's happy af. 11/10 https://t.co/IOAk9i4UvE,https://pbs.twimg.com/media/CgNLS1PW8AAxWSN.jpg,3,Pomeranian,0.99775,True,Chihuahua,0.001248,True,Pekinese,0.000775002,True
721001180231503872,,,2016-04-15 15:44:11+00:00,"<a href=""http://twitter.com/download/iphone"" rel=""nofollow"">Twitter for iPhone</a>",This is Oliver. Bath time is upon him. His fear of the wetness postpones his ultimate pupper destiny. 11/10 https://t.co/AFzzKqR4tT,,,,https://twitter.com/dog_rates/status/721001180231503872/photo/1,11,10,Oliver,,,pupper,,pupper,7.210011802315039e+17,686.0,2748.0,721001180231503872,This is Oliver. Bath time is upon him. His fear of the wetness postpones his ultimate pupper destiny. 11/10 https://t.co/AFzzKqR4tT,https://pbs.twimg.com/media/CgGCvxAUkAAx55r.jpg,1,Samoyed,0.950053,True,washbasin,0.00632139,False,tub,0.00624335,False
720775346191278080,,,2016-04-15 00:46:48+00:00,"<a href=""http://twitter.com/download/iphone"" rel=""nofollow"">Twitter for iPhone</a>",This is Berkeley. He's in a predicament. 10/10 someone help him https://t.co/XSEXdQupej,,,,https://twitter.com/dog_rates/status/720775346191278080/photo/1,10,10,Berkeley,,,,,,7.207753461912781e+17,760.0,2702.0,720775346191278080,This is Berkeley. He's in a predicament. 10/10 someone help him https://t.co/XSEXdQupej,https://pbs.twimg.com/media/CgC1WqMW4AI1_N0.jpg,1,Newfoundland,0.48997,True,groenendael,0.174497,True,giant_schnauzer,0.07906669999999999,True
720415127506415616,,,2016-04-14 00:55:25+00:00,"<a href=""http://twitter.com/download/iphone"" rel=""nofollow"">Twitter for iPhone</a>",Garden's coming in nice this year. 10/10 https://t.co/5Lra3e4rrw,,,,"https://twitter.com/dog_rates/status/720415127506415616/photo/1,https://twitter.com/dog_rates/status/720415127506415616/photo/1,https://twitter.com/dog_rates/status/720415127506415616/photo/1",10,10,None,,,,,,7.204151275064156e+17,1681.0,4503.0,720415127506415616,Garden's coming in nice this year. 10/10 https://t.co/5Lra3e4rrw,https://pbs.twimg.com/media/Cf9tuHUWsAAHSrV.jpg,1,Rottweiler,0.990312,True,black-and-tan_coonhound,0.00249478,True,American_black_bear,0.00173312,False
720389942216527872,,,2016-04-13 23:15:21+00:00,"<a href=""http://twitter.com/download/iphone"" rel=""nofollow"">Twitter for iPhone</a>",This is RalphÃ©. He patrols the lake. Looking for babes. 11/10 https://t.co/Pb6iMmo0wk,,,,https://twitter.com/dog_rates/status/720389942216527872/photo/1,11,10,RalphÃ©,,,,,,7.203899422165279e+17,2840.0,6974.0,720389942216527872,This is RalphÃ©. He patrols the lake. Looking for babes. 11/10 https://t.co/Pb6iMmo0wk,https://pbs.twimg.com/media/Cf9W1J-UMAErahM.jpg,1,Pembroke,0.873977,True,Cardigan,0.0433385,True,Eskimo_dog,0.0191971,True
719991154352222208,,,2016-04-12 20:50:42+00:00,"<a href=""http://twitter.com/download/iphone"" rel=""nofollow"">Twitter for iPhone</a>",This doggo was initially thrilled when she saw the happy cartoon pup but quickly realized she'd been deceived. 10/10 https://t.co/mvnBGaWULV,,,,"https://twitter.com/dog_rates/status/719991154352222208/photo/1,https://twitter.com/dog_rates/status/719991154352222208/photo/1",10,10,None,doggo,,,,doggo,7.199911543522222e+17,1979.0,5281.0,719991154352222208,This doggo was initially thrilled when she saw the happy cartoon pup but quickly realized she'd been deceived. 10/10 https://t.co/mvnBGaWULV,https://pbs.twimg.com/media/Cf3sH62VAAA-LiP.jpg,2,golden_retriever,0.605304,True,cocker_spaniel,0.130948,True,Labrador_retriever,0.0946916,True
719551379208073216,,,2016-04-11 15:43:12+00:00,"<a href=""http://twitter.com/download/iphone"" rel=""nofollow"">Twitter for iPhone</a>",This is Harnold. He accidentally opened the front facing camera. 10/10 get it together Harnold https://t.co/S6JHaSMtln,,,,https://twitter.com/dog_rates/status/719551379208073216/photo/1,10,10,Harnold,,,,,,7.195513792080732e+17,2192.0,5515.0,719551379208073216,This is Harnold. He accidentally opened the front facing camera. 10/10 get it together Harnold https://t.co/S6JHaSMtln,https://pbs.twimg.com/media/CfxcKU6W8AE-wEx.jpg,1,malamute,0.873233,True,Siberian_husky,0.07643539999999999,True,Eskimo_dog,0.035745,True
719367763014393856,,,2016-04-11 03:33:34+00:00,"<a href=""http://twitter.com/download/iphone"" rel=""nofollow"">Twitter for iPhone</a>",Meet Sid &amp; Murphy. Murphy floats alongside Sid and whispers motivational quotes in his ear. Magical af. Both 11/10 https://t.co/7mmjyearQW,,,,https://twitter.com/dog_rates/status/719367763014393856/photo/1,11,10,Sid,,,,,,7.193677630143939e+17,827.0,3022.0,719367763014393856,Meet Sid &amp; Murphy. Murphy floats alongside Sid and whispers motivational quotes in his ear. Magical af. Both 11/10 https://t.co/7mmjyearQW,https://pbs.twimg.com/media/Cfu1KSRXEAACC5X.jpg,1,swing,0.171486,False,soft-coated_wheaten_terrier,0.050971,True,Tibetan_terrier,0.0477594,True
719332531645071360,,,2016-04-11 01:13:34+00:00,"<a href=""http://twitter.com/download/iphone"" rel=""nofollow"">Twitter for iPhone</a>",This is Pippa. She managed to start the car but is waiting for you to buckle up before driving. Responsible af 11/10 https://t.co/htrlmC7saz,,,,https://twitter.com/dog_rates/status/719332531645071360/photo/1,11,10,Pippa,,,,,,7.193325316450714e+17,1078.0,3711.0,719332531645071360,This is Pippa. She managed to start the car but is waiting for you to buckle up before driving. Responsible af 11/10 https://t.co/htrlmC7saz,https://pbs.twimg.com/media/CfuVGl3WEAEKb16.jpg,1,Dandie_Dinmont,0.224415,True,miniature_poodle,0.204882,True,Norfolk_terrier,0.0906329,True
718971898235854848,,,2016-04-10 01:20:33+00:00,"<a href=""http://twitter.com/download/iphone"" rel=""nofollow"">Twitter for iPhone</a>",This is Sadie. She is prepared for battle. 10/10 https://t.co/JRckDkZVRT,,,,https://twitter.com/dog_rates/status/718971898235854848/photo/1,10,10,Sadie,,,,,,7.189718982358548e+17,1231.0,3818.0,718971898235854848,This is Sadie. She is prepared for battle. 10/10 https://t.co/JRckDkZVRT,https://pbs.twimg.com/media/CfpNGTHUIAAA8XC.jpg,1,golden_retriever,0.14039400000000002,True,Saint_Bernard,0.118769,True,Labrador_retriever,0.0754917,True
718939241951195136,,,2016-04-09 23:10:47+00:00,"<a href=""http://twitter.com/download/iphone"" rel=""nofollow"">Twitter for iPhone</a>",This is Otis. Everybody look at Otis. 12/10 would probably faint while petting https://t.co/I9qoe1uEih,,,,https://twitter.com/dog_rates/status/718939241951195136/photo/1,12,10,Otis,,,,,,7.189392419511951e+17,1973.0,5720.0,718939241951195136,This is Otis. Everybody look at Otis. 12/10 would probably faint while petting https://t.co/I9qoe1uEih,https://pbs.twimg.com/media/CfovbK4WIAAkTn3.jpg,1,Pembroke,0.7663270000000001,True,Cardigan,0.222126,True,toilet_tissue,0.00675723,False
718631497683582976,,,2016-04-09 02:47:55+00:00,"<a href=""http://twitter.com/download/iphone"" rel=""nofollow"">Twitter for iPhone</a>",We normally don't rate marshmallows but this one appears to be flawlessly toasted so I'll make an exception. 10/10 https://t.co/D9jbbmPmos,,,,https://twitter.com/dog_rates/status/718631497683582976/photo/1,10,10,None,,,,,,7.18631497683583e+17,9126.0,20697.0,718631497683582976,We normally don't rate marshmallows but this one appears to be flawlessly toasted so I'll make an exception. 10/10 https://t.co/D9jbbmPmos,https://pbs.twimg.com/media/CfkXiX6W4AAmICF.jpg,1,Pomeranian,0.993718,True,Pekinese,0.00361083,True,Persian_cat,0.000524823,False
718460005985447936,,,2016-04-08 15:26:28+00:00,"<a href=""http://twitter.com/download/iphone"" rel=""nofollow"">Twitter for iPhone</a>",Meet Bowie. He's listening for underground squirrels. Smart af. Left eye is considerably magical. 9/10 would so pet https://t.co/JyNmyjy3fe,,,,https://twitter.com/dog_rates/status/718460005985447936/photo/1,9,10,Bowie,,,,,,7.18460005985448e+17,602.0,2846.0,718460005985447936,Meet Bowie. He's listening for underground squirrels. Smart af. Left eye is considerably magical. 9/10 would so pet https://t.co/JyNmyjy3fe,https://pbs.twimg.com/media/Cfh7j6CWQAAndTd.jpg,1,badger,0.356946,False,Boston_bull,0.252781,True,kelpie,0.113433,True
718246886998687744,,,2016-04-08 01:19:36+00:00,"<a href=""http://twitter.com/download/iphone"" rel=""nofollow"">Twitter for iPhone</a>",This is Alexanderson. He's got a weird ass birth mark. Dreadful at fetch. Won't eat kibble. 3/10 wtf @Target https://t.co/FmxOpf2Sgl,,,,https://twitter.com/dog_rates/status/718246886998687744/photo/1,3,10,Alexanderson,,,,,,7.182468869986877e+17,565.0,2115.0,718246886998687744,This is Alexanderson. He's got a weird ass birth mark. Dreadful at fetch. Won't eat kibble. 3/10 wtf @Target https://t.co/FmxOpf2Sgl,https://pbs.twimg.com/media/Cfe5tLWXEAIaoFO.jpg,1,Chihuahua,0.354488,True,carton,0.159672,False,Siberian_husky,0.05749830000000001,True
718234618122661888,,,2016-04-08 00:30:51+00:00,"<a href=""http://twitter.com/download/iphone"" rel=""nofollow"">Twitter for iPhone</a>",This is Suki. She was born with a blurry tail (unfortunate). Next level tongue tho. 11/10 nifty hardwood https://t.co/05S8oYztgb,,,,https://twitter.com/dog_rates/status/718234618122661888/photo/1,11,10,Suki,,,,,,7.182346181226619e+17,1127.0,4217.0,718234618122661888,This is Suki. She was born with a blurry tail (unfortunate). Next level tongue tho. 11/10 nifty hardwood https://t.co/05S8oYztgb,https://pbs.twimg.com/media/CfeukpmW4AEGjOE.jpg,1,malamute,0.370152,True,Siberian_husky,0.356398,True,Eskimo_dog,0.271042,True
717841801130979328,,,2016-04-06 22:29:56+00:00,"<a href=""http://twitter.com/download/iphone"" rel=""nofollow"">Twitter for iPhone</a>",This is Barclay. His father was a banana. 11/10 appeeling af https://t.co/ucOEfr2rjV,,,,https://twitter.com/dog_rates/status/717841801130979328/photo/1,11,10,Barclay,,,,,,7.178418011309793e+17,670.0,2660.0,717841801130979328,This is Barclay. His father was a banana. 11/10 appeeling af https://t.co/ucOEfr2rjV,https://pbs.twimg.com/media/CfZJTphWAAAl5Ys.jpg,1,Brittany_spaniel,0.922876,True,English_springer,0.0701135,True,bath_towel,0.00256079,False
717421804990701568,,,2016-04-05 18:41:02+00:00,"<a href=""http://twitter.com/download/iphone"" rel=""nofollow"">Twitter for iPhone</a>",This is Ebby. She's a Zimbabwean Feta. Embarrassed by ridiculously squishy face. 9/10 would squeeze softly https://t.co/LBJqxMGaHi,,,,"https://twitter.com/dog_rates/status/717421804990701568/photo/1,https://twitter.com/dog_rates/status/717421804990701568/photo/1",9,10,Ebby,,,,,,7.174218049907016e+17,945.0,3446.0,717421804990701568,This is Ebby. She's a Zimbabwean Feta. Embarrassed by ridiculously squishy face. 9/10 would squeeze softly https://t.co/LBJqxMGaHi,https://pbs.twimg.com/media/CfTLUYWXEAEkyES.jpg,2,miniature_pinscher,0.286479,True,Italian_greyhound,0.0841339,True,beagle,0.064697,True
717047459982213120,,,2016-04-04 17:53:31+00:00,"<a href=""http://twitter.com/download/iphone"" rel=""nofollow"">Twitter for iPhone</a>",This is FlÃ¡vio (pronounced Baxter). He's a Benesnoop Cumberdog. Super rare. Symmetrical. 12/10 would pet so well https://t.co/fGgleFiBPq,,,,https://twitter.com/dog_rates/status/717047459982213120/photo/1,12,10,FlÃ¡vio,,,,,,7.170474599822131e+17,2135.0,6826.0,717047459982213120,This is FlÃ¡vio (pronounced Baxter). He's a Benesnoop Cumberdog. Super rare. Symmetrical. 12/10 would pet so well https://t.co/fGgleFiBPq,https://pbs.twimg.com/media/CfN23ArXEAEkZkz.jpg,1,golden_retriever,0.983548,True,Labrador_retriever,0.0121854,True,cocker_spaniel,0.00241203,True
716802964044845056,,,2016-04-04 01:41:58+00:00,"<a href=""http://twitter.com/download/iphone"" rel=""nofollow"">Twitter for iPhone</a>",This is Link. He struggles with couches. 10/10 would assist https://t.co/SbX4e6Yg3o,,,,"https://twitter.com/dog_rates/status/716802964044845056/photo/1,https://twitter.com/dog_rates/status/716802964044845056/photo/1",10,10,Link,,,,,,7.16802964044845e+17,1317.0,4627.0,716802964044845056,This is Link. He struggles with couches. 10/10 would assist https://t.co/SbX4e6Yg3o,https://pbs.twimg.com/media/CfKYfeBXIAAopp2.jpg,2,malinois,0.619577,True,Leonberg,0.118089,True,bull_mastiff,0.06650779999999999,True
716791146589110272,,,2016-04-04 00:55:01+00:00,"<a href=""http://twitter.com/download/iphone"" rel=""nofollow"">Twitter for iPhone</a>",Meet Jennifur. She's supposed to be navigating. Not even buckled up. Insubordinate &amp; churlish. 11/10 would still pet https://t.co/h0trcJohYO,,,,https://twitter.com/dog_rates/status/716791146589110272/photo/1,11,10,Jennifur,,,,,,7.167911465891103e+17,1474.0,5204.0,716791146589110272,Meet Jennifur. She's supposed to be navigating. Not even buckled up. Insubordinate &amp; churlish. 11/10 would still pet https://t.co/h0trcJohYO,https://pbs.twimg.com/media/CfKNvU8WsAAvI9Z.jpg,1,Pomeranian,0.468751,True,seat_belt,0.154652,False,golden_retriever,0.12501700000000002,True
716285507865542656,,,2016-04-02 15:25:47+00:00,"<a href=""http://twitter.com/download/iphone"" rel=""nofollow"">Twitter for iPhone</a>",This is Stephanus. She stays woke. 12/10 https://t.co/WIWabMngQZ,,,,"https://twitter.com/dog_rates/status/716285507865542656/photo/1,https://twitter.com/dog_rates/status/716285507865542656/photo/1",12,10,Stephanus,,,,,,7.162855078655427e+17,1225.0,3041.0,716285507865542656,This is Stephanus. She stays woke. 12/10 https://t.co/WIWabMngQZ,https://pbs.twimg.com/media/CfDB3aJXEAAEZNv.jpg,1,Yorkshire_terrier,0.43042,True,silky_terrier,0.196769,True,cairn,0.07267610000000001,True
716080869887381504,,,2016-04-02 01:52:38+00:00,"<a href=""http://twitter.com/download/iphone"" rel=""nofollow"">Twitter for iPhone</a>",Here's a super majestic doggo and a sunset 11/10 https://t.co/UACnoyi8zu,,,,"https://twitter.com/dog_rates/status/716080869887381504/photo/1,https://twitter.com/dog_rates/status/716080869887381504/photo/1",11,10,None,doggo,,,,doggo,7.160808698873815e+17,1935.0,5272.0,716080869887381504,Here's a super majestic doggo and a sunset 11/10 https://t.co/UACnoyi8zu,https://pbs.twimg.com/media/CfAHv83UMAIEQYx.jpg,1,golden_retriever,0.638625,True,chow,0.254717,True,Tibetan_mastiff,0.0717317,True
715928423106027520,,,2016-04-01 15:46:52+00:00,"<a href=""http://twitter.com/download/iphone"" rel=""nofollow"">Twitter for iPhone</a>",This is Bubbles. He's a Yorkshire Piccolope. 11/10 would snug aggressively https://t.co/3BhMojONxq,,,,https://twitter.com/dog_rates/status/715928423106027520/photo/1,11,10,Bubbles,,,,,,7.159284231060275e+17,987.0,3485.0,715928423106027520,This is Bubbles. He's a Yorkshire Piccolope. 11/10 would snug aggressively https://t.co/3BhMojONxq,https://pbs.twimg.com/media/Ce99GhLW8AAHG38.jpg,1,pug,0.976685,True,French_bulldog,0.0196626,True,bull_mastiff,0.00227819,True
715733265223708672,,,2016-04-01 02:51:22+00:00,"<a href=""http://twitter.com/download/iphone"" rel=""nofollow"">Twitter for iPhone</a>",This is a taco. We only rate dogs. Please only send in dogs. Dogs are what we rate. Not tacos. Thank you... 10/10 https://t.co/cxl6xGY8B9,,,,https://twitter.com/dog_rates/status/715733265223708672/photo/1,10,10,a,,,,,,7.157332652237087e+17,1920.0,5093.0,715733265223708672,This is a taco. We only rate dogs. Please only send in dogs. Dogs are what we rate. Not tacos. Thank you... 10/10 https://t.co/cxl6xGY8B9,https://pbs.twimg.com/media/Ce7LlUeUUAEQkQl.jpg,1,Dandie_Dinmont,0.740229,True,miniature_poodle,0.0819151,True,toy_poodle,0.0637485,True
715696743237730304,,,2016-04-01 00:26:15+00:00,"<a href=""http://twitter.com/download/iphone"" rel=""nofollow"">Twitter for iPhone</a>",Meet Toby. He's a Lithuanian High-Steppin Stickeroo. One of the more accomplished Stickeroos around. 10/10 so nifty https://t.co/cYPHuJYTjC,,,,https://twitter.com/dog_rates/status/715696743237730304/photo/1,10,10,Toby,,,,,,7.156967432377303e+17,1454.0,4257.0,715696743237730304,Meet Toby. He's a Lithuanian High-Steppin Stickeroo. One of the more accomplished Stickeroos around. 10/10 so nifty https://t.co/cYPHuJYTjC,https://pbs.twimg.com/media/Ce6qZC2WAAAcSoI.jpg,1,Staffordshire_bullterrier,0.427836,True,pug,0.221409,True,French_bulldog,0.132135,True
715200624753819648,,,2016-03-30 15:34:51+00:00,"<a href=""http://twitter.com/download/iphone"" rel=""nofollow"">Twitter for iPhone</a>",This is Michelangelope. He's half coffee cup. Rare af. 12/10 would hug until someone stopped me https://t.co/tvVDY0G911,,,,https://twitter.com/dog_rates/status/715200624753819648/photo/1,12,10,Michelangelope,,,,,,7.152006247538196e+17,2110.0,5578.0,715200624753819648,This is Michelangelope. He's half coffee cup. Rare af. 12/10 would hug until someone stopped me https://t.co/tvVDY0G911,https://pbs.twimg.com/media/CeznK6IWEAEFUPq.jpg,1,Chihuahua,0.956787,True,beagle,0.00838287,True,Labrador_retriever,0.00834409,True
715009755312439296,,,2016-03-30 02:56:24+00:00,"<a href=""http://twitter.com/download/iphone"" rel=""nofollow"">Twitter for iPhone</a>",This is Siba. She's remarkably mobile. Very sleepy as well. 12/10 would happily transport https://t.co/TjnI33RE1i,,,,https://twitter.com/dog_rates/status/715009755312439296/photo/1,12,10,Siba,,,,,,7.150097553124393e+17,1392.0,4550.0,715009755312439296,This is Siba. She's remarkably mobile. Very sleepy as well. 12/10 would happily transport https://t.co/TjnI33RE1i,https://pbs.twimg.com/media/Cew5kyOWsAA8Y_o.jpg,1,dingo,0.31090300000000004,False,Chihuahua,0.142288,True,Cardigan,0.103945,True
714957620017307648,,,2016-03-29 23:29:14+00:00,"<a href=""http://twitter.com/download/iphone"" rel=""nofollow"">Twitter for iPhone</a>",This is Curtis. He's an Albino Haberdasher. Terrified of dandelions. They really spook him up. 10/10 it'll be ok pup https://t.co/s8YcfZrWhK,,,,https://twitter.com/dog_rates/status/714957620017307648/photo/1,10,10,Curtis,,,,,,7.149576200173076e+17,1595.0,4503.0,714957620017307648,This is Curtis. He's an Albino Haberdasher. Terrified of dandelions. They really spook him up. 10/10 it'll be ok pup https://t.co/s8YcfZrWhK,https://pbs.twimg.com/media/CewKKiOWwAIe3pR.jpg,1,Great_Pyrenees,0.251516,True,Samoyed,0.139346,True,kuvasz,0.129005,True
714606013974974464,,,2016-03-29 00:12:05+00:00,"<a href=""http://twitter.com/download/iphone"" rel=""nofollow"">Twitter for iPhone</a>",Here are two lil cuddly puppers. Both 12/10 would snug like so much https://t.co/zO4eb7C4tG,,,,https://twitter.com/dog_rates/status/714606013974974464/photo/1,12,10,None,,,,,,7.146060139749745e+17,1038.0,3938.0,714606013974974464,Here are two lil cuddly puppers. Both 12/10 would snug like so much https://t.co/zO4eb7C4tG,https://pbs.twimg.com/media/CerKYG8WAAM1aE-.jpg,1,Norfolk_terrier,0.293007,True,Labrador_retriever,0.256198,True,golden_retriever,0.129643,True
714214115368108032,,,2016-03-27 22:14:49+00:00,"<a href=""http://twitter.com/download/iphone"" rel=""nofollow"">Twitter for iPhone</a>",Happy Easter from the squad! ðŸ‡ðŸ¶ 13/10 for all https://t.co/YMx4KWJUAB,,,,https://twitter.com/dog_rates/status/714214115368108032/photo/1,13,10,None,,,,,,7.14214115368108e+17,990.0,2480.0,714214115368108032,Happy Easter from the squad! ðŸ‡ðŸ¶ 13/10 for all https://t.co/YMx4KWJUAB,https://pbs.twimg.com/media/Cell8ikWIAACCJ-.jpg,1,pug,0.533967,True,bloodhound,0.164826,True,German_shepherd,0.046524,True
