tweet_id,in_reply_to_status_id,in_reply_to_user_id,timestamp,source,text,retweeted_status_id,retweeted_status_user_id,retweeted_status_timestamp,expanded_urls,rating_numerator,rating_denominator,name,doggo,floofer,pupper,puppo,dog_stage,id,retweet_count,favorite_count,id_str,full_text,jpg_url,img_num,p1,p1_conf,p1_dog,p2,p2_conf,p2_dog,p3,p3_conf,p3_dog
678334497360859136,,,2015-12-19 22:02:01+00:00,"<a href=""http://twitter.com/download/iphone"" rel=""nofollow"">Twitter for iPhone</a>",This is Rosie. She has a snazzy bow tie and a fin for a tail. Probably super fast underwater. Cool socks 10/10 https://t.co/GO76MdGBs0,,,,https://twitter.com/dog_rates/status/678334497360859136/photo/1,10,10,Rosie,,,,,,6.783344973608591e+17,304.0,1427.0,678334497360859136,This is Rosie. She has a snazzy bow tie and a fin for a tail. Probably super fast underwater. Cool socks 10/10 https://t.co/GO76MdGBs0,https://pbs.twimg.com/media/CWntoDVWcAEl3NB.jpg,1,Norfolk_terrier,0.378643,True,golden_retriever,0.0955939,True,kelpie,0.0853092,True
678278586130948096,,,2015-12-19 18:19:51+00:00,"<a href=""http://twitter.com/download/iphone"" rel=""nofollow"">Twitter for iPhone</a>",Another spooky pupper here. Most definitely floating. No legs. Probably knows some dark magic. 10/10 very spooked https://t.co/JK8MByRzgj,,,,https://twitter.com/dog_rates/status/678278586130948096/photo/1,10,10,None,,,pupper,,pupper,6.782785861309481e+17,6857.0,12531.0,678278586130948096,Another spooky pupper here. Most definitely floating. No legs. Probably knows some dark magic. 10/10 very spooked https://t.co/JK8MByRzgj,https://pbs.twimg.com/media/CWm6xySUEAAqfFU.jpg,1,Maltese_dog,0.897841,True,Lhasa,0.0357175,True,Tibetan_terrier,0.017107499999999998,True
678255464182861824,,,2015-12-19 16:47:58+00:00,"<a href=""http://twitter.com/download/iphone"" rel=""nofollow"">Twitter for iPhone</a>",This is Jessifer. She is a Bismoth Teriyaki. Flowers being attacked by hurricanes on bandana (rad). 9/10 stellar pup https://t.co/nZhmRwZzWv,,,,https://twitter.com/dog_rates/status/678255464182861824/photo/1,9,10,Jessifer,,,,,,6.782554641828618e+17,418.0,1726.0,678255464182861824,This is Jessifer. She is a Bismoth Teriyaki. Flowers being attacked by hurricanes on bandana (rad). 9/10 stellar pup https://t.co/nZhmRwZzWv,https://pbs.twimg.com/media/CWmlvxJU4AEAqaN.jpg,1,Chihuahua,0.613819,True,Yorkshire_terrier,0.127931,True,Pomeranian,0.062124300000000014,True
677918531514703872,,,2015-12-18 18:29:07+00:00,"<a href=""http://twitter.com/download/iphone"" rel=""nofollow"">Twitter for iPhone</a>","""Everything looks pretty good in there. Make sure to brush your gums. Been flossing? How's school going?"" Both 10/10 https://t.co/lWL2IMJqLR",,,,https://twitter.com/dog_rates/status/677918531514703872/photo/1,10,10,None,,,,,,6.779185315147039e+17,463.0,1476.0,677918531514703872,"""Everything looks pretty good in there. Make sure to brush your gums. Been flossing? How's school going?"" Both 10/10 https://t.co/lWL2IMJqLR",https://pbs.twimg.com/media/CWhzTbzWUAAEAUN.jpg,1,Eskimo_dog,0.199347,True,dalmatian,0.153225,True,American_Staffordshire_terrier,0.107798,True
677895101218201600,,,2015-12-18 16:56:01+00:00,"<a href=""http://twitter.com/download/iphone"" rel=""nofollow"">Twitter for iPhone</a>",Guys this was terrifying. Really spooked me up. We don't rate ghosts. We rate dogs. Please only send dogs... 9/10 https://t.co/EJImi1udYb,,,,https://twitter.com/dog_rates/status/677895101218201600/photo/1,9,10,None,,,,,,6.778951012182016e+17,2384.0,5275.0,677895101218201600,Guys this was terrifying. Really spooked me up. We don't rate ghosts. We rate dogs. Please only send dogs... 9/10 https://t.co/EJImi1udYb,https://pbs.twimg.com/media/CWhd_7WWsAAaqWG.jpg,1,dalmatian,0.550702,True,kuvasz,0.0602264,True,Great_Pyrenees,0.058631,True
677716515794329600,,,2015-12-18 05:06:23+00:00,"<a href=""http://twitter.com/download/iphone"" rel=""nofollow"">Twitter for iPhone</a>",IT'S PUPPERGEDDON. Total of 144/120 ...I think https://t.co/ZanVtAtvIq,,,,https://twitter.com/dog_rates/status/677716515794329600/photo/1,144,120,None,,,,,,6.777165157943296e+17,1104.0,3323.0,677716515794329600,IT'S PUPPERGEDDON. Total of 144/120 ...I think https://t.co/ZanVtAtvIq,https://pbs.twimg.com/media/CWe7kw9W4AE8UJh.jpg,1,teddy,0.6629079999999999,False,crib,0.0318912,False,chow,0.0254378,True
677557565589463040,,,2015-12-17 18:34:46+00:00,"<a href=""http://twitter.com/download/iphone"" rel=""nofollow"">Twitter for iPhone</a>",Reckless pupper here. Not even looking at road. Absolute menace. No regard for fellow pupper lives. 10/10 still cute https://t.co/96IBkOYB7j,,,,https://twitter.com/dog_rates/status/677557565589463040/photo/1,10,10,None,,,pupper,,pupper,6.77557565589463e+17,1322.0,2665.0,677557565589463040,Reckless pupper here. Not even looking at road. Absolute menace. No regard for fellow pupper lives. 10/10 still cute https://t.co/96IBkOYB7j,https://pbs.twimg.com/media/CWcrAVQWEAA6QMp.jpg,1,seat_belt,0.27725700000000003,False,Shih-Tzu,0.249017,True,Pekinese,0.209213,True
677547928504967168,,,2015-12-17 17:56:29+00:00,"<a href=""http://twitter.com/download/iphone"" rel=""nofollow"">Twitter for iPhone</a>",Not much to say here. I just think everyone needs to see this. 12/10 https://t.co/AGag0hFHpe,,,,https://twitter.com/dog_rates/status/677547928504967168/photo/1,12,10,None,,,,,,6.775479285049672e+17,4076.0,7568.0,677547928504967168,Not much to say here. I just think everyone needs to see this. 12/10 https://t.co/AGag0hFHpe,https://pbs.twimg.com/media/CWciPonWEAUOqLD.jpg,1,American_Staffordshire_terrier,0.914978,True,Staffordshire_bullterrier,0.08439529999999999,True,boxer,0.000461663,True
677530072887205888,,,2015-12-17 16:45:31+00:00,"<a href=""http://twitter.com/download/iphone"" rel=""nofollow"">Twitter for iPhone</a>",Say hello to Axel. He's a Black Chevy Pinot on wheels. 0 to 60 in 5.7 seconds (if downhill). 9/10 I call shotgun https://t.co/DKe9DBnnHE,,,,https://twitter.com/dog_rates/status/677530072887205888/photo/1,9,10,Axel,,,,,,6.775300728872059e+17,250.0,1161.0,677530072887205888,Say hello to Axel. He's a Black Chevy Pinot on wheels. 0 to 60 in 5.7 seconds (if downhill). 9/10 I call shotgun https://t.co/DKe9DBnnHE,https://pbs.twimg.com/media/CWcSAI-WUAAOB9W.jpg,1,Staffordshire_bullterrier,0.6892590000000001,True,Norwegian_elkhound,0.026121,True,American_Staffordshire_terrier,0.0230747,True
677334615166730240,,,2015-12-17 03:48:51+00:00,"<a href=""http://twitter.com/download/iphone"" rel=""nofollow"">Twitter for iPhone</a>",This dog gave up mid jump. 9/10 https://t.co/KmMv3Y2zI8,,,,"https://twitter.com/dog_rates/status/677334615166730240/photo/1,https://twitter.com/dog_rates/status/677334615166730240/photo/1",9,10,None,,,,,,6.773346151667302e+17,328.0,1477.0,677334615166730240,This dog gave up mid jump. 9/10 https://t.co/KmMv3Y2zI8,https://pbs.twimg.com/media/CWZgPPUWUAAUOvu.jpg,2,Lakeland_terrier,0.859392,True,Airedale,0.0672917,True,Irish_water_spaniel,0.0495306,True
677331501395156992,,,2015-12-17 03:36:28+00:00,"<a href=""http://twitter.com/download/iphone"" rel=""nofollow"">Twitter for iPhone</a>",Meet Humphrey. He's a Northern Polyp Viagra. One ear works. Face stuck like that. Always surprised. 9/10 petable af https://t.co/FS7eJQM2F4,,,,https://twitter.com/dog_rates/status/677331501395156992/photo/1,9,10,Humphrey,,,,,,6.77331501395157e+17,265.0,1189.0,677331501395156992,Meet Humphrey. He's a Northern Polyp Viagra. One ear works. Face stuck like that. Always surprised. 9/10 petable af https://t.co/FS7eJQM2F4,https://pbs.twimg.com/media/CWZdaGxXAAAjGjb.jpg,1,beagle,0.313464,True,boxer,0.21850300000000006,True,French_bulldog,0.106462,True
677328882937298944,,,2015-12-17 03:26:04+00:00,"<a href=""http://twitter.com/download/iphone"" rel=""nofollow"">Twitter for iPhone</a>",This is Derek. All the dogs adore Derek. He's a great guy. 10/10 really solid pup https://t.co/KgcsGNb61s,,,,https://twitter.com/dog_rates/status/677328882937298944/photo/1,10,10,Derek,,,,,,6.77328882937299e+17,1693.0,3938.0,677328882937298944,This is Derek. All the dogs adore Derek. He's a great guy. 10/10 really solid pup https://t.co/KgcsGNb61s,https://pbs.twimg.com/media/CWZbBlAUsAAjRg5.jpg,1,water_buffalo,0.42425,False,kelpie,0.0290541,True,Staffordshire_bullterrier,0.0284697,True
677301033169788928,,,2015-12-17 01:35:24+00:00,"<a href=""http://twitter.com/download/iphone"" rel=""nofollow"">Twitter for iPhone</a>",This is Juckson. He's totally on his way to a nascar race. 5/10 for Juckson https://t.co/IoLRvF0Kak,,,,https://twitter.com/dog_rates/status/677301033169788928/photo/1,5,10,Juckson,,,,,,6.773010331697889e+17,471.0,1362.0,677301033169788928,This is Juckson. He's totally on his way to a nascar race. 5/10 for Juckson https://t.co/IoLRvF0Kak,https://pbs.twimg.com/media/CWZBsjPWsAAZFFl.jpg,1,Japanese_spaniel,0.6611779999999999,True,Pekinese,0.150119,True,Chihuahua,0.11972,True
677269281705472000,,,2015-12-16 23:29:14+00:00,"<a href=""http://twitter.com/download/iphone"" rel=""nofollow"">Twitter for iPhone</a>",This is the happiest pupper I've ever seen. 10/10 would trade lives with https://t.co/ep8ATEJwRb,,,,https://twitter.com/dog_rates/status/677269281705472000/photo/1,10,10,the,,,pupper,,pupper,6.77269281705472e+17,790.0,2164.0,677269281705472000,This is the happiest pupper I've ever seen. 10/10 would trade lives with https://t.co/ep8ATEJwRb,https://pbs.twimg.com/media/CWYk0WxWoAAEwRt.jpg,1,Shetland_sheepdog,0.656616,True,collie,0.195405,True,German_shepherd,0.0131032,True
677187300187611136,,,2015-12-16 18:03:28+00:00,"<a href=""http://twitter.com/download/iphone"" rel=""nofollow"">Twitter for iPhone</a>",Here we see a Byzantine Rigatoni. Very aerodynamic. No eyes. Actually not windy here they just look like that. 9/10 https://t.co/gzI0m6wXRo,,,,https://twitter.com/dog_rates/status/677187300187611136/photo/1,9,10,None,,,,,,6.771873001876111e+17,1033.0,2981.0,677187300187611136,Here we see a Byzantine Rigatoni. Very aerodynamic. No eyes. Actually not windy here they just look like that. 9/10 https://t.co/gzI0m6wXRo,https://pbs.twimg.com/media/CWXaQMBWcAAATDi.jpg,1,English_setter,0.282396,True,Shih-Tzu,0.08411189999999999,True,Old_English_sheepdog,0.059538,True
676957860086095872,,,2015-12-16 02:51:45+00:00,"<a href=""http://twitter.com/download/iphone"" rel=""nofollow"">Twitter for iPhone</a>",10/10 I'd follow this dog into battle no questions asked https://t.co/ngTNXYQF0L,,,,https://twitter.com/dog_rates/status/676957860086095872/video/1,10,10,None,,,,,,6.769578600860959e+17,907.0,2395.0,676957860086095872,10/10 I'd follow this dog into battle no questions asked https://t.co/ngTNXYQF0L,https://pbs.twimg.com/ext_tw_video_thumb/676957802976419840/pu/img/dCj-qlXo73A5hf6Q.jpg,1,Labrador_retriever,0.772423,True,beagle,0.055901699999999985,True,golden_retriever,0.0311519,True
676936541936185344,,,2015-12-16 01:27:03+00:00,"<a href=""http://twitter.com/download/iphone"" rel=""nofollow"">Twitter for iPhone</a>",Here we see a rare pouched pupper. Ample storage space. Looks alert. Jumps at random. Kicked open that door. 8/10 https://t.co/mqvaxleHRz,,,,https://twitter.com/dog_rates/status/676936541936185344/photo/1,8,10,None,,,pupper,,pupper,6.769365419361853e+17,5515.0,13809.0,676936541936185344,Here we see a rare pouched pupper. Ample storage space. Looks alert. Jumps at random. Kicked open that door. 8/10 https://t.co/mqvaxleHRz,https://pbs.twimg.com/media/CWT2MUgWIAECWig.jpg,1,Chesapeake_Bay_retriever,0.5452859999999999,True,Norwegian_elkhound,0.081482,True,space_heater,0.0473911,False
676864501615042560,,,2015-12-15 20:40:47+00:00,"<a href=""http://twitter.com/download/iphone"" rel=""nofollow"">Twitter for iPhone</a>",Meet Ash. He's just a head now. Lost his body during the Third Crusade. Still in good spirits. 10/10 would pet well https://t.co/NJj2uP0atK,,,,https://twitter.com/dog_rates/status/676864501615042560/photo/1,10,10,Ash,,,,,,6.768645016150426e+17,808.0,2294.0,676864501615042560,Meet Ash. He's just a head now. Lost his body during the Third Crusade. Still in good spirits. 10/10 would pet well https://t.co/NJj2uP0atK,https://pbs.twimg.com/media/CWS0q8iU8AE2Srr.jpg,1,Chesapeake_Bay_retriever,0.371146,True,water_buffalo,0.0995963,False,Weimaraner,0.0489679,True
676811746707918848,,,2015-12-15 17:11:09+00:00,"<a href=""http://twitter.com/download/iphone"" rel=""nofollow"">Twitter for iPhone</a>",Say hello to Penny &amp; Gizmo. They are practicing their caroling. The ambition in the room is tangible. 9/10 for both https://t.co/aqBHjjh5VD,,,,https://twitter.com/dog_rates/status/676811746707918848/photo/1,9,10,Penny,,,,,,6.768117467079188e+17,469.0,1536.0,676811746707918848,Say hello to Penny &amp; Gizmo. They are practicing their caroling. The ambition in the room is tangible. 9/10 for both https://t.co/aqBHjjh5VD,https://pbs.twimg.com/media/CWSEsO9WwAAX-fZ.jpg,1,Chihuahua,0.440916,True,Pomeranian,0.345806,True,cocker_spaniel,0.0603312,True
676617503762681856,,,2015-12-15 04:19:18+00:00,"<a href=""http://twitter.com/download/iphone"" rel=""nofollow"">Twitter for iPhone</a>",I promise this wasn't meant to be a cuteness overload account but ermergerd look at this cozy pupper. 13/10 https://t.co/mpQl2rJjDh,,,,https://twitter.com/dog_rates/status/676617503762681856/photo/1,13,10,None,,,pupper,,pupper,6.766175037626819e+17,1108.0,3149.0,676617503762681856,I promise this wasn't meant to be a cuteness overload account but ermergerd look at this cozy pupper. 13/10 https://t.co/mpQl2rJjDh,https://pbs.twimg.com/media/CWPUB9TWwAALPPx.jpg,1,Chihuahua,0.841084,True,Pomeranian,0.12053,True,Pekinese,0.00660034,True
676606785097199616,,,2015-12-15 03:36:42+00:00,"<a href=""http://twitter.com/download/iphone"" rel=""nofollow"">Twitter for iPhone</a>",*screeches for a sec and then faints* 12/10 https://t.co/N5QL4ySBEx,,,,https://twitter.com/dog_rates/status/676606785097199616/photo/1,12,10,None,,,,,,6.766067850971996e+17,490.0,2039.0,676606785097199616,*screeches for a sec and then faints* 12/10 https://t.co/N5QL4ySBEx,https://pbs.twimg.com/media/CWPKSGpWcAQN6mw.jpg,1,Loafer,0.202999,False,doormat,0.200411,False,malinois,0.1423,True
676603393314578432,,,2015-12-15 03:23:14+00:00,"<a href=""http://twitter.com/download/iphone"" rel=""nofollow"">Twitter for iPhone</a>",This is Godzilla pupper. He had a ruff childhood &amp; now deflects that pain outward by terrorizing cities. Tragic 9/10 https://t.co/g1tLGkyaxr,,,,https://twitter.com/dog_rates/status/676603393314578432/photo/1,9,10,Godzilla,,,pupper,,pupper,6.766033933145784e+17,440.0,1280.0,676603393314578432,This is Godzilla pupper. He had a ruff childhood &amp; now deflects that pain outward by terrorizing cities. Tragic 9/10 https://t.co/g1tLGkyaxr,https://pbs.twimg.com/media/CWPHMqKVAAAE78E.jpg,1,whippet,0.8770209999999999,True,Great_Dane,0.0341819,True,boxer,0.028404,True
676582956622721024,,,2015-12-15 02:02:01+00:00,"<a href=""http://twitter.com/download/iphone"" rel=""nofollow"">Twitter for iPhone</a>","Meet Vinnie. He's having fun while being safe. Well not a lot of fun, but definitely safe, and that's important 8/10 https://t.co/vZYtynZZlH",,,,https://twitter.com/dog_rates/status/676582956622721024/photo/1,8,10,Vinnie,,,,,,6.76582956622721e+17,312.0,1310.0,676582956622721024,"Meet Vinnie. He's having fun while being safe. Well not a lot of fun, but definitely safe, and that's important 8/10 https://t.co/vZYtynZZlH",https://pbs.twimg.com/media/CWO0m8tUwAAB901.jpg,1,seat_belt,0.790028,False,Boston_bull,0.196307,True,French_bulldog,0.0124289,True
676533798876651520,,,2015-12-14 22:46:41+00:00,"<a href=""http://twitter.com/download/iphone"" rel=""nofollow"">Twitter for iPhone</a>",ITSOFLUFFAYYYYY 12/10 https://t.co/bfw13CnuuZ,,,,https://twitter.com/dog_rates/status/676533798876651520/photo/1,12,10,None,,,,,,6.765337988766515e+17,621.0,2025.0,676533798876651520,ITSOFLUFFAYYYYY 12/10 https://t.co/bfw13CnuuZ,https://pbs.twimg.com/media/CWOH4s9U8AEtkmQ.jpg,1,chow,0.26527399999999995,True,ice_bear,0.167614,False,fur_coat,0.117506,False
676430933382295552,,,2015-12-14 15:57:56+00:00,"<a href=""http://twitter.com/download/iphone"" rel=""nofollow"">Twitter for iPhone</a>","Meet Duke. He's an Urban Parmesan. They know he's scared of the green rubber dog. ""Why u do dis?"" thinks Duke. 10/10 https://t.co/3bim9U5Idr",,,,https://twitter.com/dog_rates/status/676430933382295552/photo/1,10,10,Duke,,,,,,6.764309333822956e+17,385.0,1526.0,676430933382295552,"Meet Duke. He's an Urban Parmesan. They know he's scared of the green rubber dog. ""Why u do dis?"" thinks Duke. 10/10 https://t.co/3bim9U5Idr",https://pbs.twimg.com/media/CWMqV7WUYAEEClG.jpg,1,golden_retriever,0.583875,True,cocker_spaniel,0.203671,True,Labrador_retriever,0.0361217,True
676263575653122048,,,2015-12-14 04:52:55+00:00,"<a href=""http://twitter.com/download/iphone"" rel=""nofollow"">Twitter for iPhone</a>",All this pupper wanted to do was go skiing. No one told him about the El NiÃ±o. Poor pupper. 10/10 maybe next year https://t.co/fTgbq1UBR9,,,,https://twitter.com/dog_rates/status/676263575653122048/photo/1,10,10,None,,,pupper,,pupper,6.76263575653122e+17,609.0,2243.0,676263575653122048,All this pupper wanted to do was go skiing. No one told him about the El NiÃ±o. Poor pupper. 10/10 maybe next year https://t.co/fTgbq1UBR9,https://pbs.twimg.com/media/CWKSIfUUYAAiOBO.jpg,1,teddy,0.0982826,False,toy_poodle,0.0980293,True,shopping_basket,0.07785210000000001,False
676219687039057920,,,2015-12-14 01:58:31+00:00,"<a href=""http://twitter.com/download/iphone"" rel=""nofollow"">Twitter for iPhone</a>",This is Kenneth. He's stuck in a bubble. 10/10 hang in there Kenneth https://t.co/uQt37xlYMJ,,,,https://twitter.com/dog_rates/status/676219687039057920/photo/1,10,10,Kenneth,,,,,,6.762196870390579e+17,31989.0,67100.0,676219687039057920,This is Kenneth. He's stuck in a bubble. 10/10 hang in there Kenneth https://t.co/uQt37xlYMJ,https://pbs.twimg.com/media/CWJqN9iWwAAg86R.jpg,1,bubble,0.997556,False,leafhopper,0.000158961,False,whippet,0.000132464,True
676101918813499392,,,2015-12-13 18:10:33+00:00,"<a href=""http://twitter.com/download/iphone"" rel=""nofollow"">Twitter for iPhone</a>",Meet Striker. He's ready for Christmas. 11/10 https://t.co/B3xxSLjQSH,,,,https://twitter.com/dog_rates/status/676101918813499392/photo/1,11,10,Striker,,,,,,6.761019188134994e+17,1284.0,3042.0,676101918813499392,Meet Striker. He's ready for Christmas. 11/10 https://t.co/B3xxSLjQSH,https://pbs.twimg.com/media/CWH_FTgWIAAwOUy.jpg,1,Shih-Tzu,0.225848,True,Norfolk_terrier,0.186873,True,Irish_terrier,0.10698699999999997,True
676089483918516224,,,2015-12-13 17:21:08+00:00,"<a href=""http://twitter.com/download/iphone"" rel=""nofollow"">Twitter for iPhone</a>","""Yes hello I'ma just snag this here toasted bagel real quick. carry on."" 9/10 https://t.co/Cuz0Osnekp",,,,https://twitter.com/dog_rates/status/676089483918516224/photo/1,9,10,None,,,,,,6.760894839185162e+17,483.0,1431.0,676089483918516224,"""Yes hello I'ma just snag this here toasted bagel real quick. carry on."" 9/10 https://t.co/Cuz0Osnekp",https://pbs.twimg.com/media/CWHzzFGXIAA0Y_H.jpg,1,bull_mastiff,0.743808,True,boxer,0.106697,True,American_Staffordshire_terrier,0.0423353,True
675888385639251968,,,2015-12-13 04:02:03+00:00,"<a href=""http://twitter.com/download/iphone"" rel=""nofollow"">Twitter for iPhone</a>",Breathtaking scene. A father taking care of his newborn pup. Tugs at the heartstrings. 10/10 restores my faith https://t.co/06oZdehGEa,,,,https://twitter.com/dog_rates/status/675888385639251968/photo/1,10,10,None,,,,,,6.75888385639252e+17,1067.0,2581.0,675888385639251968,Breathtaking scene. A father taking care of his newborn pup. Tugs at the heartstrings. 10/10 restores my faith https://t.co/06oZdehGEa,https://pbs.twimg.com/media/CWE85snWIAEG5ES.jpg,1,West_Highland_white_terrier,0.672117,True,Old_English_sheepdog,0.146147,True,komondor,0.023141400000000003,True
675878199931371520,,,2015-12-13 03:21:34+00:00,"<a href=""http://twitter.com/download/iphone"" rel=""nofollow"">Twitter for iPhone</a>","Ok, I'll admit this is a pretty adorable bunny hopping towards the ocean but please only send in dogs... 11/10 https://t.co/sfsVCGIipI",,,,https://twitter.com/dog_rates/status/675878199931371520/photo/1,11,10,None,,,,,,6.758781999313715e+17,1570.0,4531.0,675878199931371520,"Ok, I'll admit this is a pretty adorable bunny hopping towards the ocean but please only send in dogs... 11/10 https://t.co/sfsVCGIipI",https://pbs.twimg.com/media/CWEzo19WoAEiOCj.jpg,1,wood_rabbit,0.785756,False,hare,0.118181,False,Cardigan,0.0436271,True
675870721063669760,6.75707330206548e+17,4196983835.0,2015-12-13 02:51:51+00:00,"<a href=""http://twitter.com/download/iphone"" rel=""nofollow"">Twitter for iPhone</a>",&amp; this is Yoshi. Another world record contender 11/10 (what the hell is happening why are there so many contenders?) https://t.co/QG708dDNH6,,,,https://twitter.com/dog_rates/status/675870721063669760/photo/1,11,10,None,,,,,,6.758707210636698e+17,632.0,1783.0,675870721063669760,&amp; this is Yoshi. Another world record contender 11/10 (what the hell is happening why are there so many contenders?) https://t.co/QG708dDNH6,https://pbs.twimg.com/media/CWEs1b-WEAEhq82.jpg,1,golden_retriever,0.263892,True,Welsh_springer_spaniel,0.184193,True,beagle,0.182241,True
675853064436391936,,,2015-12-13 01:41:41+00:00,"<a href=""http://twitter.com/download/iphone"" rel=""nofollow"">Twitter for iPhone</a>",Here we have an entire platoon of puppers. Total score: 88/80 would pet all at once https://t.co/y93p6FLvVw,,,,"https://twitter.com/dog_rates/status/675853064436391936/photo/1,https://twitter.com/dog_rates/status/675853064436391936/photo/1",88,80,None,,,,,,6.75853064436392e+17,1460.0,2927.0,675853064436391936,Here we have an entire platoon of puppers. Total score: 88/80 would pet all at once https://t.co/y93p6FLvVw,https://pbs.twimg.com/media/CWEcxqWVEAAHyGH.jpg,1,Labrador_retriever,0.868367,True,golden_retriever,0.0433046,True,vizsla,0.0282072,True
675845657354215424,,,2015-12-13 01:12:15+00:00,"<a href=""http://twitter.com/download/iphone"" rel=""nofollow"">Twitter for iPhone</a>","This is Pepper. She's not fully comfortable riding her imaginary bike yet. 10/10 don't worry pupper, it gets easier https://t.co/40dj4eTsXG",,,,https://twitter.com/dog_rates/status/675845657354215424/photo/1,10,10,Pepper,,,pupper,,pupper,6.758456573542154e+17,1000.0,2477.0,675845657354215424,"This is Pepper. She's not fully comfortable riding her imaginary bike yet. 10/10 don't worry pupper, it gets easier https://t.co/40dj4eTsXG",https://pbs.twimg.com/media/CWEWClfW4AAnqhG.jpg,1,pug,0.8839520000000001,True,Boston_bull,0.0110568,True,French_bulldog,0.00983981,True
675822767435051008,,,2015-12-12 23:41:18+00:00,"<a href=""http://twitter.com/download/iphone"" rel=""nofollow"">Twitter for iPhone</a>",ðŸŽ¶ HELLO FROM THE OTHER SIIIIIIIIDE ðŸŽ¶ 10/10s https://t.co/GK2HJtkdQk,,,,https://twitter.com/dog_rates/status/675822767435051008/photo/1,10,10,None,,,,,,6.75822767435051e+17,591.0,1652.0,675822767435051008,ðŸŽ¶ HELLO FROM THE OTHER SIIIIIIIIDE ðŸŽ¶ 10/10s https://t.co/GK2HJtkdQk,https://pbs.twimg.com/media/CWEBOFYWwAA-O2c.jpg,1,Pomeranian,0.4607100000000001,True,chow,0.202765,True,Pekinese,0.133266,True
675798442703122432,,,2015-12-12 22:04:39+00:00,"<a href=""http://twitter.com/download/iphone"" rel=""nofollow"">Twitter for iPhone</a>",This is Bernie. He just touched a boob for the first time. 10/10 https://t.co/whQKMygnK6,,,,https://twitter.com/dog_rates/status/675798442703122432/photo/1,10,10,Bernie,,,,,,6.757984427031224e+17,3787.0,11101.0,675798442703122432,This is Bernie. He just touched a boob for the first time. 10/10 https://t.co/whQKMygnK6,https://pbs.twimg.com/media/CWDrGH4UYAARoq_.jpg,1,beagle,0.681218,True,basset,0.125121,True,boxer,0.0803982,True
675781562965868544,,,2015-12-12 20:57:34+00:00,"<a href=""http://twitter.com/download/iphone"" rel=""nofollow"">Twitter for iPhone</a>",Say hello to Buddah. He was Waldo for Halloween. 11/10 https://t.co/DVAqAnb624,,,,https://twitter.com/dog_rates/status/675781562965868544/photo/1,11,10,Buddah,,,,,,6.757815629658685e+17,537.0,1750.0,675781562965868544,Say hello to Buddah. He was Waldo for Halloween. 11/10 https://t.co/DVAqAnb624,https://pbs.twimg.com/media/CWDbv2yU4AARfeH.jpg,1,Maltese_dog,0.921968,True,West_Highland_white_terrier,0.0178107,True,toy_poodle,0.0135554,True
675710890956750848,,,2015-12-12 16:16:45+00:00,"<a href=""http://twitter.com/download/iphone"" rel=""nofollow"">Twitter for iPhone</a>",This is Lenny. He was just told that he couldn't explore the fish tank. 12/10 smh all that work for nothing https://t.co/JWi6YrpiO1,,,,"https://twitter.com/dog_rates/status/675710890956750848/photo/1,https://twitter.com/dog_rates/status/675710890956750848/photo/1",12,10,Lenny,,,,,,6.757108909567508e+17,928.0,2046.0,675710890956750848,This is Lenny. He was just told that he couldn't explore the fish tank. 12/10 smh all that work for nothing https://t.co/JWi6YrpiO1,https://pbs.twimg.com/media/CWCbd8ZWoAAtqoH.jpg,2,standard_schnauzer,0.4414270000000001,True,miniature_schnauzer,0.248885,True,Sealyham_terrier,0.164967,True
675707330206547968,6.754971033223864e+17,4196983835.0,2015-12-12 16:02:36+00:00,"<a href=""http://twitter.com/download/iphone"" rel=""nofollow"">Twitter for iPhone</a>",We've got ourselves a battle here. Watch out Reggie. 11/10 https://t.co/ALJvbtcwf0,,,,https://twitter.com/dog_rates/status/675707330206547968/photo/1,11,10,None,,,,,,6.75707330206548e+17,771.0,2154.0,675707330206547968,We've got ourselves a battle here. Watch out Reggie. 11/10 https://t.co/ALJvbtcwf0,https://pbs.twimg.com/media/CWCYOqWUAAARmGr.jpg,1,bath_towel,0.721933,False,Staffordshire_bullterrier,0.0593442,True,bagel,0.035701599999999986,False
