tweet_id,in_reply_to_status_id,in_reply_to_user_id,timestamp,source,text,retweeted_status_id,retweeted_status_user_id,retweeted_status_timestamp,expanded_urls,rating_numerator,rating_denominator,name,doggo,floofer,pupper,puppo,dog_stage,id,retweet_count,favorite_count,id_str,full_text,jpg_url,img_num,p1,p1_conf,p1_dog,p2,p2_conf,p2_dog,p3,p3_conf,p3_dog
798209839306514432,,,2016-11-14 17:03:50+00:00,"<a href=""http://twitter.com/download/iphone"" rel=""nofollow"">Twitter for iPhone</a>",This is Cooper. His bow tie was too heavy for the front so he moved it to the side. Balanced af now. 13/10 https://t.co/jG1PAFkB81,,,,https://twitter.com/dog_rates/status/798209839306514432/photo/1,13,10,Cooper,,,,,,7.982098393065144e+17,2954.0,11548.0,798209839306514432,This is Cooper. His bow tie was too heavy for the front so he moved it to the side. Balanced af now. 13/10 https://t.co/jG1PAFkB81,https://pbs.twimg.com/media/CxPPnCYWIAAo_ao.jpg,1,Pekinese,0.524583,True,Shih-Tzu,0.102931,True,Pomeranian,0.0978931,True
797545162159308800,,,2016-11-12 21:02:38+00:00,"<a href=""http://twitter.com/download/iphone"" rel=""nofollow"">Twitter for iPhone</a>",This is Cassie. She steals things. Guilt increases slightly each time. 12/10 would forgive almost immediately https://t.co/Ia19irLwyB,,,,"https://twitter.com/dog_rates/status/797545162159308800/photo/1,https://twitter.com/dog_rates/status/797545162159308800/photo/1,https://twitter.com/dog_rates/status/797545162159308800/photo/1,https://twitter.com/dog_rates/status/797545162159308800/photo/1",12,10,Cassie,,,,,,7.975451621593088e+17,5656.0,16198.0,797545162159308800,This is Cassie. She steals things. Guilt increases slightly each time. 12/10 would forgive almost immediately https://t.co/Ia19irLwyB,https://pbs.twimg.com/media/CxFzFAAUAAA5C9z.jpg,1,Pembroke,0.954089,True,Cardigan,0.033643900000000004,True,papillon,0.00973566,True
797236660651966464,,,2016-11-12 00:36:46+00:00,"<a href=""http://twitter.com/download/iphone"" rel=""nofollow"">Twitter for iPhone</a>",This is Pancake. She loves Batman and winks like a h*ckin champ. 12/10 real crowd pleaser https://t.co/6kqsAjJNhi,,,,"https://twitter.com/dog_rates/status/797236660651966464/photo/1,https://twitter.com/dog_rates/status/797236660651966464/photo/1",12,10,Pancake,,,,,,7.972366606519665e+17,7726.0,22328.0,797236660651966464,This is Pancake. She loves Batman and winks like a h*ckin champ. 12/10 real crowd pleaser https://t.co/6kqsAjJNhi,https://pbs.twimg.com/media/CxBafisWQAAtJ1X.jpg,2,collie,0.767005,True,Border_collie,0.100844,True,kelpie,0.0483681,True
796759840936919040,,,2016-11-10 17:02:03+00:00,"<a href=""http://twitter.com/download/iphone"" rel=""nofollow"">Twitter for iPhone</a>",Say hello to Romeo. He was just told that it's too cold for the pool. H*ckin nonsense. 11/10 would help fill up https://t.co/6hx7ur6sNI,,,,"https://twitter.com/dog_rates/status/796759840936919040/photo/1,https://twitter.com/dog_rates/status/796759840936919040/photo/1",11,10,Romeo,,,,,,7.96759840936919e+17,3562.0,13256.0,796759840936919040,Say hello to Romeo. He was just told that it's too cold for the pool. H*ckin nonsense. 11/10 would help fill up https://t.co/6hx7ur6sNI,https://pbs.twimg.com/media/Cw6o1JQXcAAtP78.jpg,1,American_Staffordshire_terrier,0.463996,True,Staffordshire_bullterrier,0.155566,True,Weimaraner,0.137587,True
796484825502875648,,,2016-11-09 22:49:15+00:00,"<a href=""http://twitter.com/download/iphone"" rel=""nofollow"">Twitter for iPhone</a>",Here's a sleepy doggo that requested some assistance. 12/10 would carry everywhere https://t.co/bvkkqOjNDV,,,,https://twitter.com/dog_rates/status/796484825502875648/photo/1,12,10,None,doggo,,,,doggo,7.964848255028756e+17,2042.0,8472.0,796484825502875648,Here's a sleepy doggo that requested some assistance. 12/10 would carry everywhere https://t.co/bvkkqOjNDV,https://pbs.twimg.com/media/Cw2uty8VQAAB0pL.jpg,1,cocker_spaniel,0.116924,True,seat_belt,0.107511,False,Australian_terrier,0.0998434,True
796387464403357696,,,2016-11-09 16:22:22+00:00,"<a href=""http://twitter.com/download/iphone"" rel=""nofollow"">Twitter for iPhone</a>",This is Snicku. He's having trouble reading because he's a dog. Glasses only helped a little. Nap preferred. 12/10 would snug well https://t.co/cVLUasbKA5,,,,"https://twitter.com/dog_rates/status/796387464403357696/photo/1,https://twitter.com/dog_rates/status/796387464403357696/photo/1",12,10,Snicku,,,,,,7.963874644033577e+17,4861.0,12334.0,796387464403357696,This is Snicku. He's having trouble reading because he's a dog. Glasses only helped a little. Nap preferred. 12/10 would snug well https://t.co/cVLUasbKA5,https://pbs.twimg.com/media/Cw1WKu1UQAAvWsu.jpg,1,Pekinese,0.461164,True,Pomeranian,0.28865,True,Siamese_cat,0.052423,False
795464331001561088,,,2016-11-07 03:14:10+00:00,"<a href=""http://twitter.com/download/iphone"" rel=""nofollow"">Twitter for iPhone</a>",Elder doggo does a splash. Both 13/10 incredible stuff https://t.co/gBUDjdEcqz,,,,https://twitter.com/dog_rates/status/795464331001561088/video/1,13,10,None,doggo,,,,doggo,7.954643310015611e+17,27728.0,55683.0,795464331001561088,Elder doggo does a splash. Both 13/10 incredible stuff https://t.co/gBUDjdEcqz,https://pbs.twimg.com/ext_tw_video_thumb/795464066940764160/pu/img/jPkMMQXdydb7CqFX.jpg,1,golden_retriever,0.193082,True,Chesapeake_Bay_retriever,0.157927,True,soft-coated_wheaten_terrier,0.124684,True
794332329137291264,,,2016-11-04 00:15:59+00:00,"<a href=""http://twitter.com/download/iphone"" rel=""nofollow"">Twitter for iPhone</a>",This is Nimbus (like the cloud). He just bought this fancy af duck raincoat. Only protects one ear tho. 12/10 so h*ckin floofy https://t.co/SIQbb8c3AU,,,,https://twitter.com/dog_rates/status/794332329137291264/photo/1,12,10,Nimbus,,,,,,7.943323291372913e+17,3088.0,10686.0,794332329137291264,This is Nimbus (like the cloud). He just bought this fancy af duck raincoat. Only protects one ear tho. 12/10 so h*ckin floofy https://t.co/SIQbb8c3AU,https://pbs.twimg.com/media/CwYJBiHXgAQlvrh.jpg,1,Samoyed,0.988307,True,malamute,0.00490635,True,Great_Pyrenees,0.00290129,True
793962221541933056,,,2016-11-02 23:45:19+00:00,"<a href=""http://twitter.com/download/iphone"" rel=""nofollow"">Twitter for iPhone</a>",This is Maximus. His face is stuck like that. Tragic really. Great tongue tho. 12/10 would pet firmly https://t.co/xIfrsMNLBR,,,,"https://twitter.com/dog_rates/status/793962221541933056/photo/1,https://twitter.com/dog_rates/status/793962221541933056/photo/1",12,10,Maximus,,,,,,7.93962221541933e+17,5711.0,18910.0,793962221541933056,This is Maximus. His face is stuck like that. Tragic really. Great tongue tho. 12/10 would pet firmly https://t.co/xIfrsMNLBR,https://pbs.twimg.com/media/CwS4aqZXUAAe3IO.jpg,1,Labrador_retriever,0.8616510000000001,True,golden_retriever,0.0444618,True,Staffordshire_bullterrier,0.016496700000000003,True
793845145112371200,,,2016-11-02 16:00:06+00:00,"<a href=""http://twitter.com/download/iphone"" rel=""nofollow"">Twitter for iPhone</a>",This is Clark. He was just caught wearing pants. 13/10 game-changing af https://t.co/2Xo19aPrG5,,,,https://twitter.com/dog_rates/status/793845145112371200/photo/1,13,10,Clark,,,,,,7.938451451123712e+17,2187.0,10295.0,793845145112371200,This is Clark. He was just caught wearing pants. 13/10 game-changing af https://t.co/2Xo19aPrG5,https://pbs.twimg.com/media/CwRN8H6WgAASe4X.jpg,1,Old_English_sheepdog,0.7652770000000001,True,Bedlington_terrier,0.112753,True,Kerry_blue_terrier,0.0476617,True
793601777308463104,,,2016-11-01 23:53:02+00:00,"<a href=""http://twitter.com/download/iphone"" rel=""nofollow"">Twitter for iPhone</a>",This is Dobby. I can't stop looking at her feet. 12/10 would absolutely snug https://t.co/LhzPWv6rTv,,,,https://twitter.com/dog_rates/status/793601777308463104/photo/1,12,10,Dobby,,,,,,7.936017773084631e+17,1908.0,8926.0,793601777308463104,This is Dobby. I can't stop looking at her feet. 12/10 would absolutely snug https://t.co/LhzPWv6rTv,https://pbs.twimg.com/media/CwNwmxvXEAEJ54Z.jpg,1,miniature_pinscher,0.538981,True,Chihuahua,0.21783,True,toy_terrier,0.0891487,True
793286476301799424,,,2016-11-01 03:00:09+00:00,"<a href=""http://twitter.com/download/iphone"" rel=""nofollow"">Twitter for iPhone</a>",This is Moreton. He's the Good Boy Who Lived. 13/10 magical as h*ck https://t.co/rLHGx3VAF3,,,,"https://twitter.com/dog_rates/status/793286476301799424/photo/1,https://twitter.com/dog_rates/status/793286476301799424/photo/1",13,10,Moreton,,,,,,7.932864763017994e+17,10723.0,27597.0,793286476301799424,This is Moreton. He's the Good Boy Who Lived. 13/10 magical as h*ck https://t.co/rLHGx3VAF3,https://pbs.twimg.com/media/CwJR1okWIAA6XMp.jpg,1,Afghan_hound,0.274637,True,borzoi,0.142204,True,doormat,0.109677,False
793241302385262592,,,2016-11-01 00:00:38+00:00,"<a href=""http://twitter.com/download/iphone"" rel=""nofollow"">Twitter for iPhone</a>",This is Tucker. He's out here bustin h*ckin ghosts. 13/10 dedicated af https://t.co/Ap477GhwXt,,,,https://twitter.com/dog_rates/status/793241302385262592/photo/1,13,10,Tucker,,,,,,7.932413023852626e+17,3812.0,11780.0,793241302385262592,This is Tucker. He's out here bustin h*ckin ghosts. 13/10 dedicated af https://t.co/Ap477GhwXt,https://pbs.twimg.com/media/CwIougTWcAAMLyq.jpg,1,golden_retriever,0.559308,True,Labrador_retriever,0.390222,True,cocker_spaniel,0.0363157,True
793226087023144960,,,2016-10-31 23:00:11+00:00,"<a href=""http://twitter.com/download/iphone"" rel=""nofollow"">Twitter for iPhone</a>","This is Juno. She spooked me up real good, but only to get my attention. Above average handwriting for a dog I think. 11/10 https://t.co/hFxxBCWlwj",,,,"https://twitter.com/dog_rates/status/793226087023144960/photo/1,https://twitter.com/dog_rates/status/793226087023144960/photo/1,https://twitter.com/dog_rates/status/793226087023144960/photo/1",11,10,Juno,,,,,,7.93226087023145e+17,3338.0,11001.0,793226087023144960,"This is Juno. She spooked me up real good, but only to get my attention. Above average handwriting for a dog I think. 11/10 https://t.co/hFxxBCWlwj",https://pbs.twimg.com/media/CwIa5CjW8AErZgL.jpg,1,wire-haired_fox_terrier,0.456047,True,Lakeland_terrier,0.273428,True,English_springer,0.0836433,True
793150605191548928,,,2016-10-31 18:00:14+00:00,"<a href=""http://twitter.com/download/iphone"" rel=""nofollow"">Twitter for iPhone</a>",This is Nida. She's a free elf. Waited so long for this day. 11/10 https://t.co/3lE8Izgmkf,,,,https://twitter.com/dog_rates/status/793150605191548928/photo/1,11,10,Nida,,,,,,7.931506051915489e+17,1984.0,6909.0,793150605191548928,This is Nida. She's a free elf. Waited so long for this day. 11/10 https://t.co/3lE8Izgmkf,https://pbs.twimg.com/media/CwHWOZ7W8AAHv8S.jpg,1,Italian_greyhound,0.193869,True,bluetick,0.16038,True,standard_poodle,0.12598199999999998,True
792883833364439040,,,2016-10-31 00:20:11+00:00,"<a href=""http://twitter.com/download/iphone"" rel=""nofollow"">Twitter for iPhone</a>",This is Bailey. She's rather h*ckin hype for Halloween tomorrow. Carved those pupkins herself. 12/10 https://t.co/v17mFm0Ftz,,,,"https://twitter.com/dog_rates/status/792883833364439040/photo/1,https://twitter.com/dog_rates/status/792883833364439040/photo/1,https://twitter.com/dog_rates/status/792883833364439040/photo/1,https://twitter.com/dog_rates/status/792883833364439040/photo/1",12,10,Bailey,,,,,,7.92883833364439e+17,4964.0,12666.0,792883833364439040,This is Bailey. She's rather h*ckin hype for Halloween tomorrow. Carved those pupkins herself. 12/10 https://t.co/v17mFm0Ftz,https://pbs.twimg.com/media/CwDjoH3WAAIniIs.jpg,3,jack-o'-lantern,0.999306,False,basketball,0.000113129,False,standard_poodle,8.31451e-05,True
792773781206999040,,,2016-10-30 17:02:53+00:00,"<a href=""http://twitter.com/download/iphone"" rel=""nofollow"">Twitter for iPhone</a>",This is Monster. Not an actual monster tho. He's showing you his tongue. Very impressive Monster. 12/10 would snug https://t.co/RhaPExuxJL,,,,https://twitter.com/dog_rates/status/792773781206999040/photo/1,12,10,Monster,,,,,,7.92773781206999e+17,1963.0,8209.0,792773781206999040,This is Monster. Not an actual monster tho. He's showing you his tongue. Very impressive Monster. 12/10 would snug https://t.co/RhaPExuxJL,https://pbs.twimg.com/media/CwB_i-zXEAEiP29.jpg,1,Yorkshire_terrier,0.912804,True,silky_terrier,0.06782250000000001,True,Australian_terrier,0.00445069,True
792394556390137856,,,2016-10-29 15:55:58+00:00,"<a href=""http://twitter.com/download/iphone"" rel=""nofollow"">Twitter for iPhone</a>",Meet BeBe. She rocks the messy bun of your dreams. H*ckin flawless. 12/10 would watch her tutorial https://t.co/of0pFNBIl8,,,,"https://twitter.com/dog_rates/status/792394556390137856/photo/1,https://twitter.com/dog_rates/status/792394556390137856/photo/1",12,10,BeBe,,,,,,7.923945563901379e+17,4998.0,15128.0,792394556390137856,Meet BeBe. She rocks the messy bun of your dreams. H*ckin flawless. 12/10 would watch her tutorial https://t.co/of0pFNBIl8,https://pbs.twimg.com/media/Cv8moW9W8AIHOxR.jpg,2,cocker_spaniel,0.746387,True,Irish_setter,0.0916151,True,miniature_poodle,0.061078199999999985,True
792050063153438720,,,2016-10-28 17:07:05+00:00,"<a href=""http://twitter.com/download/iphone"" rel=""nofollow"">Twitter for iPhone</a>",This is Remus. He's a mop that came to life. Can't see anything. Constantly trips over himself. Still a very good dog. 11/10 https://t.co/S3f1SYylzu,,,,"https://twitter.com/dog_rates/status/792050063153438720/photo/1,https://twitter.com/dog_rates/status/792050063153438720/photo/1",11,10,Remus,,,,,,7.920500631534387e+17,2088.0,8029.0,792050063153438720,This is Remus. He's a mop that came to life. Can't see anything. Constantly trips over himself. Still a very good dog. 11/10 https://t.co/S3f1SYylzu,https://pbs.twimg.com/media/Cv3tU38WcAASFas.jpg,2,komondor,0.942856,True,swab,0.05271519999999999,False,Tibetan_terrier,0.002743,True
791672322847637504,,,2016-10-27 16:06:04+00:00,"<a href=""http://twitter.com/download/iphone"" rel=""nofollow"">Twitter for iPhone</a>",When she says you're a good boy and you know you're a good boy because you're a good boy. 13/10 https://t.co/O5IUmRHRIh,,,,https://twitter.com/dog_rates/status/791672322847637504/photo/1,13,10,None,,,,,,7.916723228476375e+17,3661.0,13129.0,791672322847637504,When she says you're a good boy and you know you're a good boy because you're a good boy. 13/10 https://t.co/O5IUmRHRIh,https://pbs.twimg.com/media/CvyVxQRWEAAdSZS.jpg,1,golden_retriever,0.705092,True,Labrador_retriever,0.219721,True,kuvasz,0.015965,True
791406955684368384,,,2016-10-26 22:31:36+00:00,"<a href=""http://twitter.com/download/iphone"" rel=""nofollow"">Twitter for iPhone</a>",Say hello to Levi. He's a Madagascan Butterbop. One of the more docile Butterbops I've seen. 12/10 would give all the pets https://t.co/Zcw9Sccctc,,,,"https://twitter.com/dog_rates/status/791406955684368384/photo/1,https://twitter.com/dog_rates/status/791406955684368384/photo/1,https://twitter.com/dog_rates/status/791406955684368384/photo/1,https://twitter.com/dog_rates/status/791406955684368384/photo/1",12,10,Levi,,,,,,7.914069556843684e+17,4797.0,14670.0,791406955684368384,Say hello to Levi. He's a Madagascan Butterbop. One of the more docile Butterbops I've seen. 12/10 would give all the pets https://t.co/Zcw9Sccctc,https://pbs.twimg.com/media/CvukbEkWAAAV-69.jpg,4,Pembroke,0.972629,True,Cardigan,0.0270259,True,basenji,0.000152502,True
790946055508652032,,,2016-10-25 16:00:09+00:00,"<a href=""http://twitter.com/download/iphone"" rel=""nofollow"">Twitter for iPhone</a>",This is Betty. She's assisting with the dishes. Such a good puppo. 12/10 h*ckin helpful af https://t.co/dgvTPZ9tgI,,,,https://twitter.com/dog_rates/status/790946055508652032/photo/1,12,10,Betty,,,,puppo,puppo,7.90946055508652e+17,5496.0,18601.0,790946055508652032,This is Betty. She's assisting with the dishes. Such a good puppo. 12/10 h*ckin helpful af https://t.co/dgvTPZ9tgI,https://pbs.twimg.com/media/CvoBPWRWgAA4het.jpg,1,dishwasher,0.700466,False,golden_retriever,0.245773,True,chow,0.0390117,True
790698755171364864,,,2016-10-24 23:37:28+00:00,"<a href=""http://twitter.com/download/iphone"" rel=""nofollow"">Twitter for iPhone</a>",This is Mosby. He appears to be rather h*ckin snuggable af. 12/10 keep it up Mosby https://t.co/IiiBq460I7,,,,https://twitter.com/dog_rates/status/790698755171364864/photo/1,12,10,Mosby,,,,,,7.906987551713649e+17,2203.0,9158.0,790698755171364864,This is Mosby. He appears to be rather h*ckin snuggable af. 12/10 keep it up Mosby https://t.co/IiiBq460I7,https://pbs.twimg.com/media/CvkgUjbUsAEvo7l.jpg,1,Bernese_mountain_dog,0.996541,True,EntleBucher,0.00105698,True,Appenzeller,0.000997907,True
790581949425475584,,,2016-10-24 15:53:19+00:00,"<a href=""http://twitter.com/download/iphone"" rel=""nofollow"">Twitter for iPhone</a>",This is Duke. He sneaks into the fridge sometimes. It's his safe place. 11/10 would give little jacket if necessary https://t.co/Fd5WFDTMH4,,,,"https://twitter.com/dog_rates/status/790581949425475584/photo/1,https://twitter.com/dog_rates/status/790581949425475584/photo/1",11,10,Duke,,,,,,7.905819494254756e+17,8183.0,22473.0,790581949425475584,This is Duke. He sneaks into the fridge sometimes. It's his safe place. 11/10 would give little jacket if necessary https://t.co/Fd5WFDTMH4,https://pbs.twimg.com/media/Cvi2FiKWgAAif1u.jpg,2,refrigerator,0.998886,False,malinois,0.000152999,True,kelpie,0.000130817,True
789986466051088384,,,2016-10-23 00:27:05+00:00,"<a href=""http://twitter.com/download/iphone"" rel=""nofollow"">Twitter for iPhone</a>",This is Happy. He's a bathtub reviewer. Seems to be pleased with this one. 12/10 https://t.co/Ln89R4FP7v,,,,https://twitter.com/dog_rates/status/789986466051088384/photo/1,12,10,Happy,,,,,,7.899864660510884e+17,2704.0,10369.0,789986466051088384,This is Happy. He's a bathtub reviewer. Seems to be pleased with this one. 12/10 https://t.co/Ln89R4FP7v,https://pbs.twimg.com/media/CvaYgDOWgAEfjls.jpg,1,tub,0.479477,False,bathtub,0.325106,False,golden_retriever,0.07853049999999999,True
789530877013393408,,,2016-10-21 18:16:44+00:00,"<a href=""http://twitter.com/download/iphone"" rel=""nofollow"">Twitter for iPhone</a>",This is Rizzy. She smiles a lot. 12/10 contagious af https://t.co/TU4sZogVIq,,,,"https://twitter.com/dog_rates/status/789530877013393408/photo/1,https://twitter.com/dog_rates/status/789530877013393408/photo/1,https://twitter.com/dog_rates/status/789530877013393408/photo/1",12,10,Rizzy,,,,,,7.895308770133934e+17,3942.0,13188.0,789530877013393408,This is Rizzy. She smiles a lot. 12/10 contagious af https://t.co/TU4sZogVIq,https://pbs.twimg.com/media/CvT6IV6WEAQhhV5.jpg,3,schipperke,0.363272,True,kelpie,0.197021,True,Norwegian_elkhound,0.151024,True
789268448748703744,,,2016-10-21 00:53:56+00:00,"<a href=""http://twitter.com/download/iphone"" rel=""nofollow"">Twitter for iPhone</a>",This is Stella. She's happier than I will ever be. 10/10 would trade lives with https://t.co/JSs2bfDtTS,,,,https://twitter.com/dog_rates/status/789268448748703744/photo/1,10,10,Stella,,,,,,7.892684487487037e+17,3014.0,10196.0,789268448748703744,This is Stella. She's happier than I will ever be. 10/10 would trade lives with https://t.co/JSs2bfDtTS,https://pbs.twimg.com/media/CvQLdotWcAAZn86.jpg,1,malamute,0.81286,True,Siberian_husky,0.120853,True,Eskimo_dog,0.0242693,True
788908386943430656,,,2016-10-20 01:03:11+00:00,"<a href=""http://twitter.com/download/iphone"" rel=""nofollow"">Twitter for iPhone</a>","This is Lucy. She destroyed not one, but two remotes trying to turn off the debate. 11/10 relatable af https://t.co/3BXh073tDm",,,,https://twitter.com/dog_rates/status/788908386943430656/photo/1,11,10,Lucy,,,,,,7.889083869434307e+17,14409.0,30653.0,788908386943430656,"This is Lucy. She destroyed not one, but two remotes trying to turn off the debate. 11/10 relatable af https://t.co/3BXh073tDm",https://pbs.twimg.com/media/CvLD-mbWYAAFI8w.jpg,1,remote_control,0.8815379999999999,False,oscilloscope,0.0355131,False,golden_retriever,0.0340897,True
788765914992902144,,,2016-10-19 15:37:03+00:00,"<a href=""http://twitter.com/download/iphone"" rel=""nofollow"">Twitter for iPhone</a>",This is Butter. She can have whatever she wants forever. 12/10 would hug softly https://t.co/x5gXRS1abq,,,,https://twitter.com/dog_rates/status/788765914992902144/photo/1,12,10,Butter,,,,,,7.887659149929021e+17,12014.0,30658.0,788765914992902144,This is Butter. She can have whatever she wants forever. 12/10 would hug softly https://t.co/x5gXRS1abq,https://pbs.twimg.com/media/CvJCabcWgAIoUxW.jpg,1,cocker_spaniel,0.500509,True,golden_retriever,0.27273400000000003,True,jigsaw_puzzle,0.041475800000000014,False
788412144018661376,,,2016-10-18 16:11:17+00:00,"<a href=""http://twitter.com/download/iphone"" rel=""nofollow"">Twitter for iPhone</a>",This is Dexter. He breaks hearts for a living. 11/10 h*ckin handsome af https://t.co/4DhSsC1W7S,,,,"https://twitter.com/dog_rates/status/788412144018661376/photo/1,https://twitter.com/dog_rates/status/788412144018661376/photo/1",11,10,Dexter,,,,,,7.884121440186614e+17,5990.0,16060.0,788412144018661376,This is Dexter. He breaks hearts for a living. 11/10 h*ckin handsome af https://t.co/4DhSsC1W7S,https://pbs.twimg.com/media/CvEAqQoWgAADj5K.jpg,1,golden_retriever,0.805238,True,Labrador_retriever,0.113798,True,Brittany_spaniel,0.0385587,True
788150585577050112,,,2016-10-17 22:51:57+00:00,"<a href=""http://twitter.com/download/iphone"" rel=""nofollow"">Twitter for iPhone</a>",This is Leo. He's a golden chow. Rather h*ckin rare. 13/10 would give extra pats https://t.co/xosHjFzVXc,,,,"https://twitter.com/dog_rates/status/788150585577050112/photo/1,https://twitter.com/dog_rates/status/788150585577050112/photo/1,https://twitter.com/dog_rates/status/788150585577050112/photo/1,https://twitter.com/dog_rates/status/788150585577050112/photo/1",13,10,Leo,,,,,,7.881505855770501e+17,1510.0,6865.0,788150585577050112,This is Leo. He's a golden chow. Rather h*ckin rare. 13/10 would give extra pats https://t.co/xosHjFzVXc,https://pbs.twimg.com/media/CvASw6dWcAQmo3X.jpg,3,chow,0.814145,True,Pomeranian,0.112704,True,Chihuahua,0.0158832,True
787810552592695296,,,2016-10-17 00:20:47+00:00,"<a href=""http://twitter.com/download/iphone"" rel=""nofollow"">Twitter for iPhone</a>",This is Frank. He wears sunglasses and walks himself. 11/10 I'll never be this cool or independent https://t.co/pNNjBtHWPc,,,,"https://twitter.com/dog_rates/status/787810552592695296/photo/1,https://twitter.com/dog_rates/status/787810552592695296/photo/1",11,10,Frank,,,,,,7.878105525926953e+17,3540.0,9717.0,787810552592695296,This is Frank. He wears sunglasses and walks himself. 11/10 I'll never be this cool or independent https://t.co/pNNjBtHWPc,https://pbs.twimg.com/media/Cu7dg2RXYAIaGXE.jpg,2,pug,0.362835,True,French_bulldog,0.221864,True,English_setter,0.0804183,True
787717603741622272,,,2016-10-16 18:11:26+00:00,"<a href=""http://twitter.com/download/iphone"" rel=""nofollow"">Twitter for iPhone</a>",This is Tonks. She is a service puppo. Can hear a caterpillar hiccup from 7 miles away. 13/10 would follow anywhere https://t.co/i622ZbWkUp,,,,"https://twitter.com/dog_rates/status/787717603741622272/photo/1,https://twitter.com/dog_rates/status/787717603741622272/photo/1,https://twitter.com/dog_rates/status/787717603741622272/photo/1,https://twitter.com/dog_rates/status/787717603741622272/photo/1",13,10,Tonks,,,,puppo,puppo,7.877176037416223e+17,3240.0,11416.0,787717603741622272,This is Tonks. She is a service puppo. Can hear a caterpillar hiccup from 7 miles away. 13/10 would follow anywhere https://t.co/i622ZbWkUp,https://pbs.twimg.com/media/Cu6I9vvWIAAZG0a.jpg,3,German_shepherd,0.992339,True,malinois,0.00492039,True,kelpie,0.0008528019999999999,True
787322443945877504,,,2016-10-15 16:01:13+00:00,"<a href=""http://twitter.com/download/iphone"" rel=""nofollow"">Twitter for iPhone</a>",This is Lincoln. He forgot to use his blinker when he changed lanes just now. Guilty as h*ck. Still 10/10 https://t.co/lsrR83SiVp,,,,https://twitter.com/dog_rates/status/787322443945877504/photo/1,10,10,Lincoln,,,,,,7.873224439458775e+17,2032.0,8726.0,787322443945877504,This is Lincoln. He forgot to use his blinker when he changed lanes just now. Guilty as h*ck. Still 10/10 https://t.co/lsrR83SiVp,https://pbs.twimg.com/media/Cu0hlfwWYAEdnXO.jpg,1,seat_belt,0.747739,False,golden_retriever,0.105703,True,dingo,0.0172568,False
786963064373534720,,,2016-10-14 16:13:10+00:00,"<a href=""http://twitter.com/download/iphone"" rel=""nofollow"">Twitter for iPhone</a>",This is Rory. He's got an interview in a few minutes. Looking spiffy af. Nervous as h*ck tho. 12/10 would hire https://t.co/ibj5g6xaAj,,,,https://twitter.com/dog_rates/status/786963064373534720/photo/1,12,10,Rory,,,,,,7.869630643735347e+17,9327.0,29725.0,786963064373534720,This is Rory. He's got an interview in a few minutes. Looking spiffy af. Nervous as h*ck tho. 12/10 would hire https://t.co/ibj5g6xaAj,https://pbs.twimg.com/media/Cuvau3MW8AAxaRv.jpg,1,golden_retriever,0.915303,True,Saluki,0.0462126,True,Labrador_retriever,0.0375041,True
786709082849828864,,,2016-10-13 23:23:56+00:00,"<a href=""http://twitter.com/download/iphone"" rel=""nofollow"">Twitter for iPhone</a>","This is Logan, the Chow who lived. He solemnly swears he's up to lots of good. H*ckin magical af 9.75/10 https://t.co/yBO5wuqaPS",,,,https://twitter.com/dog_rates/status/786709082849828864/photo/1,75,10,Logan,,,,,,7.867090828498289e+17,7069.0,20296.0,786709082849828864,"This is Logan, the Chow who lived. He solemnly swears he's up to lots of good. H*ckin magical af 9.75/10 https://t.co/yBO5wuqaPS",https://pbs.twimg.com/media/CurzvFTXgAA2_AP.jpg,1,Pomeranian,0.467321,True,Persian_cat,0.122978,False,chow,0.102654,True
